{
  "tenant_id": "11111111-1111-4111-8111-111111111111",
  "principal_id": "2c9a4e1b-7d3f-4a6b-8e2c-5f1a9b3d7e42",
  "endpoint": "POST /v1/examples",
  "idempotency_key": "client-key-0001",
  "request_fingerprint": "sha256:9f86d081884c7d659a2feaa0c55ad015a3bf4f1b2b0b822cd15d6c15b0f00a08",
  "status": "COMPLETED",
  "response_ref": "idem/response/0001",
  "created_at": "2026-10-03T09:00:00Z",
  "expires_at": "2026-10-04T09:00:00Z"
}
